id,replyCount,likeCount,publishedAt,authorName,text,authorChannelId,authorChannelUrl,isReply,isReplyTo,isReplyToName
Ugy2AnCAyCxUMG-Uyv54AaABAg.A4ULGuzZVgDA4UbN_L-EUI,,3,"2024-06-10 01:45:15",@oquesobroudoceu6513,"Kkkkkkkk, tô nessa tbm",UC7Oqjrivg7XFkprCzDJmI9w,http://www.youtube.com/@oquesobroudoceu6513,1,Ugy2AnCAyCxUMG-Uyv54AaABAg,@ec2122ce
Ugy2AnCAyCxUMG-Uyv54AaABAg.A4ULGuzZVgDA4UnnoxG5Dk,,0,"2024-06-10 03:33:49",@thalyta2822,"Pois é, um bando de mulheres idiotas!!!! 🤦🏻‍♀️🤦🏻‍♀️🤦🏻‍♀️",UCEsZgYM7anz8y0RLaXy-AvQ,http://www.youtube.com/@thalyta2822,1,Ugy2AnCAyCxUMG-Uyv54AaABAg,@ec2122ce
Ugy2AnCAyCxUMG-Uyv54AaABAg.A4ULGuzZVgDA4V1aVhIu2K,,1,"2024-06-10 05:43:05",@marceloInfantino,"PARA DE PALHAÇADA ,BILU QUA QUA, APOIAR É UMA COISA AGORA MUITOS ESTAO PASSANDO DO LIMITE E SE A SOCIEDADE DEIXAR, QUALQUER DIA DESSES VÃO QUERER QUE O POVO FAZ REVERÊNCIA.",UCZrZy_NRlJbLeFpmyI6QY-Q,http://www.youtube.com/@marceloInfantino,1,Ugy2AnCAyCxUMG-Uyv54AaABAg,@ec2122ce
Ugy2AnCAyCxUMG-Uyv54AaABAg.A4ULGuzZVgDA4VYSnjn3Q9,,2,"2024-06-10 10:30:15",@egg8111,"Ela é muito linda pra chamar os outros de feio 😢",UCw4fJGl1LZbpe7nmPkmWlKA,http://www.youtube.com/@egg8111,1,Ugy2AnCAyCxUMG-Uyv54AaABAg,@ec2122ce
Ugy2AnCAyCxUMG-Uyv54AaABAg.A4ULGuzZVgDA4VemhlV7pg,,2,"2024-06-10 11:34:16",@Jumentim10,"No fim, a política fica cada vez mais dominada por homens Kkkkk",UCcvfF96lsWviVunXYMb3s9w,http://www.youtube.com/@Jumentim10,1,Ugy2AnCAyCxUMG-Uyv54AaABAg,@ec2122ce
Ugy2AnCAyCxUMG-Uyv54AaABAg.A4ULGuzZVgDA4WJ1JbsbYX,,1,"2024-06-10 17:34:40",@ec2122ce,"@@marceloInfantino Chora a vontade. Viva a causa trans.",UCDigftfkRsNEFolJb_1S0aQ,http://www.youtube.com/@ec2122ce,1,Ugy2AnCAyCxUMG-Uyv54AaABAg,@ec2122ce
Ugy2AnCAyCxUMG-Uyv54AaABAg.A4ULGuzZVgDA4WPwP3tZFN,,0,"2024-06-10 18:35:01",@wandersongoncalves7110,"​@@marceloInfantinoreverência a monorias legítimas, não. Mas saudações nazistas a Bolsonaro no estado da deputada de extrema-direita tudo bem?",UCNlfEklzPltJYjD8h99TJRw,http://www.youtube.com/@wandersongoncalves7110,1,Ugy2AnCAyCxUMG-Uyv54AaABAg,@ec2122ce
Ugy6C8oaCvk14VNZa8h4AaABAg,0,0,"2024-06-09 23:15:28",@Diego.Silva.,"Correios! Privatiza já!!!!",UCUignAr1O2zCIxVmip_fLMA,http://www.youtube.com/@Diego.Silva.,0,,
UgzVZUnCNc9ExRJMt8B4AaABAg,0,5,"2024-06-09 23:12:48",@giophellipe9937,"Preguiçe desse deputade, preguiçe desse movimente LGBTQAe!",UCArMBK4R_BZPIZTLBz_aSdQ,http://www.youtube.com/@giophellipe9937,0,,
UgxYuG78S-GbJVvW6AZ4AaABAg,0,0,"2024-06-09 23:08:36",@MIG-TALL_cachorreiro,"Que vídeo!",UCMFoUSRWxu8BCkbL7v84BJA,http://www.youtube.com/@MIG-TALL_cachorreiro,0,,
UgyliK-nCXF90Hm3W4l4AaABAg,6,11,"2024-06-09 23:08:32",@walmirarraesjunior1944,"Não gosto da Erika Hilton mas acho que o projeto do fim da escala 6x1 deve ser apoiada",UCTrtlmKxRFK1Ja4tTtPNUSg,http://www.youtube.com/@walmirarraesjunior1944,0,,
UgyliK-nCXF90Hm3W4l4AaABAg.A4UKRqT3peqA4UUTsarT1z,,4,"2024-06-10 00:36:12",@erikalexsispinosalamanca6031,"votei no kim, mas o silencio dele sobre esse assunto me entristece",UCNRGGSuWtx7UlJVWCLwIvEQ,http://www.youtube.com/@erikalexsispinosalamanca6031,1,UgyliK-nCXF90Hm3W4l4AaABAg,@walmirarraesjunior1944
UgyliK-nCXF90Hm3W4l4AaABAg.A4UKRqT3peqA4Ul8XwHT0T,,1,"2024-06-10 03:10:34",@rodrigomatos2954,"Tô por fora... do que se trata isso?",UC9lODkbc-K6NhUGIi4gED5w,http://www.youtube.com/@rodrigomatos2954,1,UgyliK-nCXF90Hm3W4l4AaABAg,@walmirarraesjunior1944
UgyliK-nCXF90Hm3W4l4AaABAg.A4UKRqT3peqA4Uw0P_Y3G3,,0,"2024-06-10 04:45:35",@AlexandrePts,"​@@erikalexsispinosalamanca6031 pro pessoal do mbl , eles querem retirar as leis trabalhistas e vc poder negociar os dias que vc vai trabalhar com o patrão",UCV0UvMA8kFhI3UfMdCXmVBg,http://www.youtube.com/@AlexandrePts,1,UgyliK-nCXF90Hm3W4l4AaABAg,@walmirarraesjunior1944
UgyliK-nCXF90Hm3W4l4AaABAg.A4UKRqT3peqA4VSMdZfvwE,,2,"2024-06-10 09:36:59",@Apoiadordocentrao,"​@@erikalexsispinosalamanca6031provavelmente o Kim é a favor da escala 6x1",UC3Ljpm_LduAMjr2_upCNLXg,http://www.youtube.com/@Apoiadordocentrao,1,UgyliK-nCXF90Hm3W4l4AaABAg,@walmirarraesjunior1944
UgyliK-nCXF90Hm3W4l4AaABAg.A4UKRqT3peqA4YaUxFRUXZ,,0,"2024-06-11 14:54:29",@EmanuelOliveira-dr2ys,"Devemos apoiar, independente de qualquer discordância com a deputada",UCP2LNhmmhAcKHBDJ_ZOTmQg,http://www.youtube.com/@EmanuelOliveira-dr2ys,1,UgyliK-nCXF90Hm3W4l4AaABAg,@walmirarraesjunior1944
UgyliK-nCXF90Hm3W4l4AaABAg.A4UKRqT3peqA4YacXFOJ1e,,0,"2024-06-11 14:55:39",@EmanuelOliveira-dr2ys,"​@@rodrigomatos2954Estabelecer uma carga de trabalho semanal menor que a atual, que é de 6 dias na semana Pesquise Movimento VAT",UCP2LNhmmhAcKHBDJ_ZOTmQg,http://www.youtube.com/@EmanuelOliveira-dr2ys,1,UgyliK-nCXF90Hm3W4l4AaABAg,@walmirarraesjunior1944
UgxU0ircPgJPaJIpSsl4AaABAg,0,10,"2024-06-09 23:06:57",@mateusgabriel291,"Cara perfeito o vídeo. Quase que um mergulho nas profundezas da mente em trevas desse ser humano indefinido.",UCg1yEsl_-JzqkPK8-TZbF3A,http://www.youtube.com/@mateusgabriel291,0,,
Ugz-B7RkxJ2HYywTixF4AaABAg,0,0,"2024-06-09 23:04:41",@eddiemax2744,"12:58 n aguenta 5 minutinho sincero",UCpfG5exgn_JnIY7L5gH1JcA,http://www.youtube.com/@eddiemax2744,0,,
Ugw8mPBoeSfXLaMb5Al4AaABAg,0,0,"2024-06-09 23:03:28",@Felipe_Levit,Up,UC0WlEEWmfE8A81FRs3Fc_Dg,http://www.youtube.com/@Felipe_Levit,0,,
UgwfB_CKjC4BIUDIu914AaABAg,0,1,"2024-06-09 23:02:18",@mateusgabriel291,"Mano a Boyceta e o Beti clarão são pessoas diferentes.",UCg1yEsl_-JzqkPK8-TZbF3A,http://www.youtube.com/@mateusgabriel291,0,,
Ugzrog083MMqfH6GDCN4AaABAg,0,2,"2024-06-09 23:01:19",@thiagosampaio6243,"Enquanto o MBL não entender que tem que contemplar TODAS as pessoas, isso inclui pessoas que pensam a vida diferente, vcs não vão chegar ao seus objetivos, pq o Brasil não é conservador, cristão e liberal como vcs pensam. São mais de 200 milhões de pessoas e é um pensamento pueril achar que todas foram feitas na mesma forma. E sim, o diálogo franco, aberto e desarmado com pessoas opostas ao nosso modo pessoal de pensar a vida é muitíssimo produtivo. Conhecemos o átomo, várias estruturas microscópicas mas negamos a universalidade da manifestação do comportamento humano, somos ignorantes e de fato ainda temos muito a aprender e entender as várias formas da representação da psique individual e como os meios interferem nesse desenvolvimento até a forma plena de um indivíduo. Vcs tem análises e recortes muito interessantes do pensar política, porém enquanto forem tão moleques sobre alguns assuntos não vão avançar em seus objetivos.",UCoL2i0_czUcATxlWsn3iqcA,http://www.youtube.com/@thiagosampaio6243,0,,
UgxObYBAtGubv6cVGhZ4AaABAg,1,3,"2024-06-09 23:00:39",@MarildaAntonini,"Eu dou mulher aprovo totalmente o que vc falou.....Essa Erica Hilton eu aceito apenas como mulher trans.....é impossivel tirar esse adjetivo de mulher quando se tratar de pessoas como ela....essa é uma separacao minima que toda mulher deve fazer....agora ja estao trabalhando numa lei de aceitacao de mulheres trans nos banheiros femininos....no x caimos de criticar essa deputada que esta levantando essa causa....nao vamos aceitar.....a Erica Hilton se diz mulher trans, mas é bem machista e violenta para defender qualquer causa.....vira homem rapidinho.....nao duporto isso",UCFrv3qagphW3KTs1-4Xf7Fg,http://www.youtube.com/@MarildaAntonini,0,,
UgxObYBAtGubv6cVGhZ4AaABAg.A4UJXzycQrFA4UoeHDYyg_,,2,"2024-06-10 03:41:15",@helena1712,"Olá Marilda, achei interessante o seu comentário e como uma mulher trans gostaria de esclarecer alguns pontos, primeiro ponto vc não precisa aceitar uma pessoa trans, vc não precisa ter em seu circulo social uma pessoa trans, a única coisa que vc tem de fazer é tratar com respeito e dignidade como trataria qualquer outra pessoa, e sim mulheres trans tem orgulho do adjetivo transexual, nunca vamos nos denominar como cisgênero pois temos consciência de quem somos e de onde viemos, assim como existem mulheres negras, brancas, gordas, magras, altas, baixas, jovens e velhas, o ser trans é só mais um adjetivo dentro desses milhares que já existem. Quanto a questão dos banheiros não vou me prolongar pq isso é um assunto muito complexo para ser discutido em poucas linhas, mas lhe digo uma coisa, com certeza uma mulher trans já usou o mesmo banheiro que vc e nem percebeu que ela estava ali, para finalizar, essa questão machista que vc citou não pode ser associada exclusivamente ao masculino pois existem muitas mulheres que tem atitudes e falas machistas isso é inerente ao caráter e não ao gênero de alguém, espero que tenha sido sucinta em minha explanação e agradeço desde de já a sua atenção.",UC4mRM0fFg__X1NdkiKXG_bg,http://www.youtube.com/@helena1712,1,UgxObYBAtGubv6cVGhZ4AaABAg,@MarildaAntonini
Ugz8Jz6P9EUfP2sFBUp4AaABAg,0,0,"2024-06-09 22:59:55",@robertonascimentoroberto8827,"A maioria silenciosa, continua silenciosa.",UCF8JaXzrA2xU7-nIukkOWIA,http://www.youtube.com/@robertonascimentoroberto8827,0,,
Ugy7mk1wpduwSRTDKnR4AaABAg,0,0,"2024-06-09 22:58:59",@dayanesarmento8423,"A peruca, plásticas e toda parafernália feminilizantes são aval a um indivíduo do sexo masculino ser misógino com mulheres, e ter ao fundo um bando de mulheres submissas a esse discurso é deprimente.",UC_d1N3m90YYBxiPGTjZbdeg,http://www.youtube.com/@dayanesarmento8423,0,,
UgxsPqT7R22XAjWsj794AaABAg,3,0,"2024-06-09 22:54:04",@wendellvieira5437,"Rapaz eu acho que vocês estão procurando problema escrevendo o nome Herik sem o A",UCB2hq1CHX13UxzBooqvpNLQ,http://www.youtube.com/@wendellvieira5437,0,,
UgxsPqT7R22XAjWsj794AaABAg.A4UImoeAjAlA4UIp-Yky2e,,0,"2024-06-09 22:54:22",@wendellvieira5437,"Na tumb*",UCB2hq1CHX13UxzBooqvpNLQ,http://www.youtube.com/@wendellvieira5437,1,UgxsPqT7R22XAjWsj794AaABAg,@wendellvieira5437
UgxsPqT7R22XAjWsj794AaABAg.A4UImoeAjAlA4UmuzSi5xE,,0,"2024-06-10 03:26:04",@rodrigomatos2954,"Tá atrás da cabeça da deputade 🙃",UC9lODkbc-K6NhUGIi4gED5w,http://www.youtube.com/@rodrigomatos2954,1,UgxsPqT7R22XAjWsj794AaABAg,@wendellvieira5437
UgxsPqT7R22XAjWsj794AaABAg.A4UImoeAjAlA4XCmZsdxpm,,0,"2024-06-11 01:59:20",@Gamer.1981,"O nome dela é Felipe",UCXHAPzw91TknKskTdE-9o1w,http://www.youtube.com/@Gamer.1981,1,UgxsPqT7R22XAjWsj794AaABAg,@wendellvieira5437
UgyAYkQY_iagfuB2g394AaABAg,0,0,"2024-06-09 22:53:09",@davioliveiraaz,"Erika e pabllo vittar a msm coisas kkkkkkk mds q burro",UC30PLWzBvAIAV2WpHL2cVXA,http://www.youtube.com/@davioliveiraaz,0,,
UgyOtAzAtDlb_fjlwY54AaABAg,0,1,"2024-06-09 22:52:21",@thiagosampaio6243,"Pelos comentários do vídeo se nota a pobreza intelectual do Brasil.",UCoL2i0_czUcATxlWsn3iqcA,http://www.youtube.com/@thiagosampaio6243,0,,
UgwZdpA2tnRAYjYkQx54AaABAg,0,0,"2024-06-09 22:50:21",@thalves1496,"Criança trans é o caralho",UCUooEbHfzlSg61ttuOXaxDw,http://www.youtube.com/@thalves1496,0,,
UgwJKkpud-d7Lbsixh14AaABAg,0,0,"2024-06-09 22:44:11",@wellington-mi9gt,"Kkkkkkkkkkkk Erica é um transformer misógino e circense😅",UCfojPhmFgCanXg1y94wrYrg,http://www.youtube.com/@wellington-mi9gt,0,,
UgzBblZt7-e8VC18K3p4AaABAg,0,0,"2024-06-09 22:43:30",@pachaves1982,"Só chamarei isso de mulher se ela apresentar um DNA pelo Fleury",UCI2ZWVwaYrYOepP27G3I5Hg,http://www.youtube.com/@pachaves1982,0,,
Ugz9Wcftk-6sHc8jcpZ4AaABAg,0,1,"2024-06-09 22:42:52",@TiagoSilva-ll2bj,"Simplificando tudo, mulheres vcs estão sendo usadas...",UCxkZadphlXSU9Dgdue3F1vg,http://www.youtube.com/@TiagoSilva-ll2bj,0,,
UgxEboOSXCFwmjc5v5d4AaABAg,0,0,"2024-06-09 22:42:19",@emerson.lake.palmer,"Tem gente que transita entre ladrão e (achar que é) honesto.",UCM-USEPfiMoJK-f62Dm9zHA,http://www.youtube.com/@emerson.lake.palmer,0,,
Ugxi4oB__xDGBcsGEKJ4AaABAg,0,0,"2024-06-09 22:41:32",@8kamiyu,"Erika adora reduzir mulheres aos seus órgãos reprodutores. Experimente chamar essa criatura de ""pessoa sem útero, pessoa com próstata, XY"" etc pra ver o que acontece.",UCjMM_9NcBmfnNWu3oJU4MGA,http://www.youtube.com/@8kamiyu,0,,
Ugx326Vjk7XZwKA3FqJ4AaABAg,0,0,"2024-06-09 22:40:41",@Wasssz,"Mano esse video do boyceta é mt vergonha alheia da agonia de ver",UCAP3yX_ZidkZU5WcMYqxYAQ,http://www.youtube.com/@Wasssz,0,,
UgxqHZgHs_wTHmXwtgV4AaABAg,1,6,"2024-06-09 22:39:55",@lucastomaz1498,"engraçado que os canhoto olha o video na integra e só veem o nicolas falando (oque tambem nao vi nada demais), e esquecem da erika hilton xingando a mulher de tudo que é coisa ali",UCQ13U_gXh8D19xR78NRnSxQ,http://www.youtube.com/@lucastomaz1498,0,,
UgxqHZgHs_wTHmXwtgV4AaABAg.A4UHA8nzqgqA4UIiuu6jM9,,1,"2024-06-09 22:53:32",@mariana-s7t,"será que esquecem ou fingem que não estão vendo? eis a questão",UCmoEQ_mXbVTinTi3vuqjzvA,http://www.youtube.com/@mariana-s7t,1,UgxqHZgHs_wTHmXwtgV4AaABAg,@lucastomaz1498
UgyxmwoVMAwTaQO7_yN4AaABAg,2,28,"2024-06-09 22:39:08",@KarinaFerreiraPerru,"Eu fico tão feliz quando VCs citam essas personalidades contemporâneas e eu penso: quem? O mundo continua girando, para o bem ou para mal, continua girando.",UCWnjNOM8XFTUS67eLt3t5qA,http://www.youtube.com/@KarinaFerreiraPerru,0,,
UgyxmwoVMAwTaQO7_yN4AaABAg.A4UH4QsDYD0A4VPNqpEJjK,,0,"2024-06-10 09:10:56",@MAlditoChainsawMAn,"As pessoas só acordam quando é com elas, foi o caso do Elon Musk.",UCc0CHB5z7TnRauT8PW7kJFA,http://www.youtube.com/@MAlditoChainsawMAn,1,UgyxmwoVMAwTaQO7_yN4AaABAg,@KarinaFerreiraPerru
UgyxmwoVMAwTaQO7_yN4AaABAg.A4UH4QsDYD0A4VpUHLYD0J,,2,"2024-06-10 13:07:44",@KarinaFerreiraPerru,"@@MAlditoChainsawMAn Não sei se é uma questão de estar ou não acordado. Talvez, seja mais sobre a insignificância e a temporalidade de certos indivíduos. Há tantas questões mais importantes, pessoas e ideias mais relevantes. Quem é Erika Hilton no fim do dia? Só mais uma polêmica. É uma pena o MBL ter que perder tempo com isso. Contudo, as polêmicas e a efemeridade delas revelam muito do público brasileiro e dos limites da sua capacidade de reflexão, consumo e maturidade. Por isso, minha felicidade por não conhecer essa pessoa que não gesta. 😘",UCWnjNOM8XFTUS67eLt3t5qA,http://www.youtube.com/@KarinaFerreiraPerru,1,UgyxmwoVMAwTaQO7_yN4AaABAg,@KarinaFerreiraPerru
Ugw0KLq108SX-GZerGB4AaABAg,2,17,"2024-06-09 22:39:08",@lucasespindula8881,"um cara com bigódinho na alemanha em 1930 atacava fisicamente judeus falando de esteriótipos fisicos como nariz e outras coisas, sei la só lembrei mesmo",UCIY_-nWPgQeQ3SmpA66mf0w,http://www.youtube.com/@lucasespindula8881,0,,
Ugw0KLq108SX-GZerGB4AaABAg.A4UH4Q58Gc_A4Y_lBFeq2l,,0,"2024-06-11 14:48:06",@EmanuelOliveira-dr2ys,"Judeus não tinham fenótipo específico que os diferenciasse dos alemães da época",UCP2LNhmmhAcKHBDJ_ZOTmQg,http://www.youtube.com/@EmanuelOliveira-dr2ys,1,Ugw0KLq108SX-GZerGB4AaABAg,@lucasespindula8881
Ugw0KLq108SX-GZerGB4AaABAg.A4UH4Q58Gc_A4YmvSxOnYX,,0,"2024-06-11 16:43:05",@lucasespindula8881,"@EmanuelOliveira-dr2ys  como não jovem kkk, várias charges da época vc vê eles esteriotipando judeus abertamente, além do antisemitismo os cara se apegavam em diferentes características de algumas linhagens judias de raça pra afrontar e serem tbm racistas, tem que olhar mais história jovem",UCIY_-nWPgQeQ3SmpA66mf0w,http://www.youtube.com/@lucasespindula8881,1,Ugw0KLq108SX-GZerGB4AaABAg,@lucasespindula8881
UgyeydfnP-YnKSX7Pht4AaABAg,0,0,"2024-06-09 22:38:10",@alexandresantanameirelles4293,"Não coloque o preto no meio disso...",UCem-cfnA0tNSIpjbFCVR8uQ,http://www.youtube.com/@alexandresantanameirelles4293,0,,
Ugwf0oQjwtMq5LPrJkp4AaABAg,8,54,"2024-06-09 22:36:53",@paulao5954,"Pra mim é um péssimo Deputado Federal.",UCRFewqm1e9F4JtB_N8taMdA,http://www.youtube.com/@paulao5954,0,,
Ugwf0oQjwtMq5LPrJkp4AaABAg.A4UGoxkEKxFA4WJrwOlJ-d,,2,"2024-06-10 17:41:59",@DioneBrendou,ELE,UCKbuIzvss-Fmgg8KNpzCZ-Q,http://www.youtube.com/@DioneBrendou,1,Ugwf0oQjwtMq5LPrJkp4AaABAg,@paulao5954
Ugwf0oQjwtMq5LPrJkp4AaABAg.A4UGoxkEKxFA4WJvewCAlR,,1,"2024-06-10 17:42:30",@DioneBrendou,🤣,UCKbuIzvss-Fmgg8KNpzCZ-Q,http://www.youtube.com/@DioneBrendou,1,Ugwf0oQjwtMq5LPrJkp4AaABAg,@paulao5954
Ugwf0oQjwtMq5LPrJkp4AaABAg.A4UGoxkEKxFA4YHCac_fYR,,2,"2024-06-11 11:57:12",@eviluchiha,"Um dos piores",UCtTCWjbX0wnuSI17FxCtXLw,http://www.youtube.com/@eviluchiha,1,Ugwf0oQjwtMq5LPrJkp4AaABAg,@paulao5954
Ugwf0oQjwtMq5LPrJkp4AaABAg.A4UGoxkEKxFA4Z8RqaqKMs,,5,"2024-06-11 19:59:53",@Leon-gk9uk,"O Nicolas? Concordo, péssimo dms. Graças a Deus temos a Erika, uma excelente parlamentar. 🙌",UCwyqR73V9G0xRtQM2mHmizg,http://www.youtube.com/@Leon-gk9uk,1,Ugwf0oQjwtMq5LPrJkp4AaABAg,@paulao5954
Ugwf0oQjwtMq5LPrJkp4AaABAg.A4UGoxkEKxFA4ddoSl66ov,,1,"2024-06-13 23:18:56",@FernandoTores-fo4qm,"@@Leon-gk9uk Você gosta dele ?🤨🏳‍🌈",UCiz6mlN0p4SrlaBcSfbq-zQ,http://www.youtube.com/@FernandoTores-fo4qm,1,Ugwf0oQjwtMq5LPrJkp4AaABAg,@paulao5954
Ugwf0oQjwtMq5LPrJkp4AaABAg.A4UGoxkEKxFA4deSoRGDjx,,1,"2024-06-13 23:24:35",@Leon-gk9uk,"@@FernandoTores-fo4qm Nicolas? Tá repreendido 🤣",UCwyqR73V9G0xRtQM2mHmizg,http://www.youtube.com/@Leon-gk9uk,1,Ugwf0oQjwtMq5LPrJkp4AaABAg,@paulao5954
Ugwf0oQjwtMq5LPrJkp4AaABAg.A4UGoxkEKxFA4dljsanE-f,,0,"2024-06-14 00:28:13",@FernandoTores-fo4qm,"@@Leon-gk9uk então você gosta da ""Erika Hilton"" 😏🏳‍🌈.A esquerda e muito bicha",UCiz6mlN0p4SrlaBcSfbq-zQ,http://www.youtube.com/@FernandoTores-fo4qm,1,Ugwf0oQjwtMq5LPrJkp4AaABAg,@paulao5954
Ugwf0oQjwtMq5LPrJkp4AaABAg.A4UGoxkEKxFA4jAoBm5PGe,,0,"2024-06-16 02:52:12",@marcelodimacri9081,"​@@FernandoTores-fo4qm dela***",UCM2PQAP_t2Yw8-NIlt7_Brg,http://www.youtube.com/@marcelodimacri9081,1,Ugwf0oQjwtMq5LPrJkp4AaABAg,@paulao5954
Ugz_MXgcClgR0cCcTzR4AaABAg,1,8,"2024-06-09 22:36:24",@AndreLuis-iz2rq,"ela esqueceu dos nordestinos kkkkkkk",UCIehMw9JRqSxkvkyo7qfDHg,http://www.youtube.com/@AndreLuis-iz2rq,0,,
Ugz_MXgcClgR0cCcTzR4AaABAg.A4UGlPFlxynA4VkClrQKcP,,1,"2024-06-10 12:21:39",@luba5740,"Mas daí tem brancos, mulheres, evangélicos… (não que entre a população negra tb não tenha isso, mas aí o discurso fica ruim)",UChx5YCKBTQXH01-lveaPiMw,http://www.youtube.com/@luba5740,1,Ugz_MXgcClgR0cCcTzR4AaABAg,@AndreLuis-iz2rq
UgyPyQ7v9WdaLjh8Xml4AaABAg,0,7,"2024-06-09 22:35:50",@LucasGabriel-mm1jy,"O que eu pesso sobre Erika Hilton: 🤮🤮🤮",UCiQYNgAw9_-a-qkxpkbqAXg,http://www.youtube.com/@LucasGabriel-mm1jy,0,,
UgzTxjwhD0TruP2etwt4AaABAg,0,4,"2024-06-09 22:33:09",@Gabrielmanganelli,"Parmenides estava certo, não dá pra encarar “mudanças” aparentes como mudanças reais. A doença da disforia de gênero nos mostra claramente o quanto nossos sentimentos gerados a partir da interação dos sentidos humanos podem nos influenciar a acreditar em algo mesmo que aquilo seja irreal. Seria como acreditar que o Sol é menor que a Terra porque é isso que seus olhos te indicam.",UCD395XMOrhRAA2sswmr7qEA,http://www.youtube.com/@Gabrielmanganelli,0,,
UgxvjYC3QsLjWUciydF4AaABAg,0,0,"2024-06-09 22:32:36",@davidharllan,"Quem porra é Érika hilton? Essa daí é igual feijoada e vem com linguiça?",UCIpuycncpM27nCZDKjYSp8w,http://www.youtube.com/@davidharllan,0,,
Ugx7WzyEB9hMREZ9P4F4AaABAg,0,1,"2024-06-09 22:29:57",@larissacolliard7672,"Sou ex-feminista. Sei, por experiência própria, que o feminismo, assim como todos os movimentos “woke”, são um desserviço. Se qualquer um pode ser mulher, não existe “direito das mulheres”. Obrigada por esse vídeo!",UCys9CGk1xojz63jT9KmlvbQ,http://www.youtube.com/@larissacolliard7672,0,,
Ugwp08KzkrPqbXHmWKh4AaABAg,0,0,"2024-06-09 22:27:51",@SrDiviino,"Erika Hilton é foda.",UCDeHY2JaJfrIcPl1dYBCf9g,http://www.youtube.com/@SrDiviino,0,,
UgzmJFm-5VNtbE051_B4AaABAg,0,0,"2024-06-09 22:27:26",@andrewssantos8258,"Pessoas como esse homem biológico, vivem das aparências e exacerbação sexual, não apresentam nada concreto e efetivo para a sociedade só segregação e seletivodade conveniente à patota deles.",UC9n-CfooV3iVtlgF9DAPM0Q,http://www.youtube.com/@andrewssantos8258,0,,
UgzvCXdUYR4wrdlEjEt4AaABAg,0,0,"2024-06-09 22:25:55",@rafaeljsantos1465,🎉🎉🎉🎉🎉,UCRwSF-I7PVNbOXaH7G-ZTQQ,http://www.youtube.com/@rafaeljsantos1465,0,,
Ugz2VXG-Yczey1FQaiF4AaABAg,24,105,"2024-06-09 22:25:16",@caradorzune,"No discurso da parada gay, troca a palavra ""LGBT"" por ""arianos"" e você vai se surpreender com a semelhança do discurso com aqueles que um maluco fazia na Alemanha um tempo atrás e que resultou em um dos maiores desastres da história...",UCe186IqiF6Hf-40UyGu78cw,http://www.youtube.com/@caradorzune,0,,
Ugz2VXG-Yczey1FQaiF4AaABAg.A4UFUulruzPA4ULBmDLS1O,,17,"2024-06-09 23:15:05",@marcusbonetto154,"Meu Deus, talvez a maior merda que eu ja li nesta rede social….",UCTGM0Mhuf-XoW2pV_Mge-Zw,http://www.youtube.com/@marcusbonetto154,1,Ugz2VXG-Yczey1FQaiF4AaABAg,@caradorzune
Ugz2VXG-Yczey1FQaiF4AaABAg.A4UFUulruzPA4ULqgQOc60,,34,"2024-06-09 23:20:48",@denismoraes1076,"​@@marcusbonetto154eu acho que o comentário do cara faz todo o sentido. Faça o experimento que ele propõe e veja o resultado",UCsUyIEWi0ryKzaO0EICvz5g,http://www.youtube.com/@denismoraes1076,1,Ugz2VXG-Yczey1FQaiF4AaABAg,@caradorzune
Ugz2VXG-Yczey1FQaiF4AaABAg.A4UFUulruzPA4UN9TQQsHi,,35,"2024-06-09 23:32:15",@caradorzune,"@@marcusbonetto154 Deixa eu traduzir, talvez faltou cognição... O discurso é extremista igual. Utiliza uma veste de união mas por trás é nefasto.",UCe186IqiF6Hf-40UyGu78cw,http://www.youtube.com/@caradorzune,1,Ugz2VXG-Yczey1FQaiF4AaABAg,@caradorzune
Ugz2VXG-Yczey1FQaiF4AaABAg.A4UFUulruzPA4UOVPFJHbQ,,6,"2024-06-09 23:43:59",@marcusbonetto154,"@@caradorzune Meu comentário não foi para lhe convencer de nada. Dica de vida, as coisas não são tão simples… o grande mal dos dias atuais é a SUPERFICIALIDADE com qual os temas são tratados… fazer uma correlação com o discurso Nazi/Fascista e o discurso LGBT… não há lógica alguma. Como contribuição nesta conversa, sugiro que vc de uma olhada em alguns documentários sobre a AIDS nos anos 80 (documentários ingleses são os melhores) e sobre as eleições alemãs de 1933 (Há um filme muito bom, “Munique: O limite da guerra”, é um bom começo). Os temas não são correlatos, apenas deixo de contribuição para vc começar a se aprofundar nos temas.",UCTGM0Mhuf-XoW2pV_Mge-Zw,http://www.youtube.com/@marcusbonetto154,1,Ugz2VXG-Yczey1FQaiF4AaABAg,@caradorzune
Ugz2VXG-Yczey1FQaiF4AaABAg.A4UFUulruzPA4UOrzJDaCY,,0,"2024-06-09 23:47:12",@vanessal.6891,"Se esse cho rume Hilton pudesse, mandava toda a oposição pra campos de con... Só fingindo demência ou sendo um vrme muito canalha, pra não perceber a tentativa de generalização e desumanização em cada palavra.",UCn6fROkc8_nuVki03vB7IWA,http://www.youtube.com/@vanessal.6891,1,Ugz2VXG-Yczey1FQaiF4AaABAg,@caradorzune
Ugz2VXG-Yczey1FQaiF4AaABAg.A4UFUulruzPA4UP0N-YlVV,,7,"2024-06-09 23:48:29",@marcusbonetto154,"@@denismoraes1076 sim, a população alemã de 1932 era violentada, julgada e morta diariamente por ser alemã, tinha esquecido dessa parte da história.",UCTGM0Mhuf-XoW2pV_Mge-Zw,http://www.youtube.com/@marcusbonetto154,1,Ugz2VXG-Yczey1FQaiF4AaABAg,@caradorzune
Ugz2VXG-Yczey1FQaiF4AaABAg.A4UFUulruzPA4UPUy1uyRs,,7,"2024-06-09 23:52:39",@ulissescandido3221,"O extremismo é bem semelhante,a diferença é que aquele era homem de verdade pra lutar pelos seus ideais,mesmo sendo nefastos,este da parada é apenas um falastrão",UCvsLsWvYQeBhIeyAhiPUEMA,http://www.youtube.com/@ulissescandido3221,1,Ugz2VXG-Yczey1FQaiF4AaABAg,@caradorzune
Ugz2VXG-Yczey1FQaiF4AaABAg.A4UFUulruzPA4UPf6WIuJn,,2,"2024-06-09 23:54:11",@denismoraes1076,"@@marcusbonetto154 e os judeus?",UCsUyIEWi0ryKzaO0EICvz5g,http://www.youtube.com/@denismoraes1076,1,Ugz2VXG-Yczey1FQaiF4AaABAg,@caradorzune
Ugz2VXG-Yczey1FQaiF4AaABAg.A4UFUulruzPA4UQCWsrAIg,,3,"2024-06-09 23:58:53",@caradorzune,"@@marcusbonetto154 ah, beleza... Tenha uma ótima semana 😀",UCe186IqiF6Hf-40UyGu78cw,http://www.youtube.com/@caradorzune,1,Ugz2VXG-Yczey1FQaiF4AaABAg,@caradorzune
Ugz2VXG-Yczey1FQaiF4AaABAg.A4UFUulruzPA4UQxGfqrqH,,2,"2024-06-10 00:05:24",@marcusbonetto154,"@@denismoraes1076 Não entendi, você acompanhou o raciocínio do seu comentário? Vc disse q o discurso Nazi é igual ou equivalente ao da parada LGBT… os Judeus eram Nazis? Não entendi.. leia o que vc escreveu dnv",UCTGM0Mhuf-XoW2pV_Mge-Zw,http://www.youtube.com/@marcusbonetto154,1,Ugz2VXG-Yczey1FQaiF4AaABAg,@caradorzune
Ugz2VXG-Yczey1FQaiF4AaABAg.A4UFUulruzPA4URM06oOPu,,0,"2024-06-10 00:08:55",@marcusbonetto154,"@@ulissescandido3221 Meu, os cara nem disfarçam mais kkkkk “lutar pelos seus ideias” = assassinar qualquer pessoa q não fosse branca do olho claro.",UCTGM0Mhuf-XoW2pV_Mge-Zw,http://www.youtube.com/@marcusbonetto154,1,Ugz2VXG-Yczey1FQaiF4AaABAg,@caradorzune
Ugz2VXG-Yczey1FQaiF4AaABAg.A4UFUulruzPA4UYWmrY4nk,,0,"2024-06-10 01:11:33",@JulianoKM10,Freestyle,UCYaYAhsznuF4CQzBAlfAYuA,http://www.youtube.com/@JulianoKM10,1,Ugz2VXG-Yczey1FQaiF4AaABAg,@caradorzune
Ugz2VXG-Yczey1FQaiF4AaABAg.A4UFUulruzPA4UkOQ4vICJ,,0,"2024-06-10 03:04:00",@denismoraes1076,"@@marcusbonetto154 os lgbts parecem os nazistas e as pessoas atacadas por eles parecem os judeus. Quer que desenhe?",UCsUyIEWi0ryKzaO0EICvz5g,http://www.youtube.com/@denismoraes1076,1,Ugz2VXG-Yczey1FQaiF4AaABAg,@caradorzune
Ugz2VXG-Yczey1FQaiF4AaABAg.A4UFUulruzPA4VRgVFTnW9,,1,"2024-06-10 09:31:05",@Apoiadordocentrao,"​@@caradorzunecomentário seu foi bem digno de um país de terceiro mundo",UC3Ljpm_LduAMjr2_upCNLXg,http://www.youtube.com/@Apoiadordocentrao,1,Ugz2VXG-Yczey1FQaiF4AaABAg,@caradorzune
Ugz2VXG-Yczey1FQaiF4AaABAg.A4UFUulruzPA4V_IwUKPMY,,0,"2024-06-10 10:46:23",@diegoaugusto6598,"A deputada Julia Zanatta ele perdeu a chence de dar uma esculachada na ERIKA ela poderia falar assim ,minha querida minha perereca é original não da shoppe",UCGYd-KRwmxMp3rCkHVDccMQ,http://www.youtube.com/@diegoaugusto6598,1,Ugz2VXG-Yczey1FQaiF4AaABAg,@caradorzune
